{
  "kind": "scip-query-completion-context",
  "schemaVersion": 1,
  "contextSnapshotId": "SQCX-8FD23438DBBCAB17B4D444F7BF8173F7",
  "collaborationDomainId": "5ea57d1a-936c-4c91-b58f-5d61e45173a5",
  "changeId": "SQC-DED67E74D3898BDCA85766BE8D3C93AF",
  "goalId": "SQG-4061E7D5D360464ED8E8B05D53BBF49D",
  "goalRecordDigest": "c2cd63dc602f0dbae05b10c31b1371a25b93016c6ad24d2516501dcdc812dd13",
  "policy": {
    "policyId": "scip-query:stop-completion-policy",
    "policyVersion": 1,
    "stopMode": "feedback",
    "requiredPredicates": [
      "goal-fulfilled",
      "invariants-preserved",
      "evidence-compatible",
      "coverage-complete",
      "obligations-reconciled",
      "policy-permitted"
    ]
  },
  "evaluator": {
    "evaluatorId": "scip-query:stop-completion-controller",
    "evaluatorVersion": "0.20.0",
    "buildIdentity": "a5dffe50ec8780611c29a8c01f1604c0ee044df47ba6e815baa7ad816319a5d4"
  },
  "commandRegistry": {
    "registryIdentity": "04a8368b24aae993b68b82d482a3f75dcab20dc613684c7ec686b90f1781ae88",
    "entries": [
      "completion-controller:required-predicates-v1",
      "diff-gate:architecture",
      "diff-gate:baseline",
      "diff-gate:co-change-partner",
      "diff-gate:coverage-contract",
      "diff-gate:doc-reference",
      "diff-gate:echo",
      "diff-gate:incomplete-migration",
      "diff-gate:new-dead",
      "diff-gate:twin-partner",
      "diff-gate:unused-params",
      "stop-hook:fixed-context-v1"
    ]
  },
  "protectedArtifacts": {
    "setIdentity": "6c2e9214e7be991742e85398fe47e58d72e2d447b1050f90db7ff2fa78066cd7",
    "rules": [
      {
        "class": "goal",
        "selectors": [
          ".scipquery/goals/*.json"
        ],
        "authority": "fixed-predecessor"
      },
      {
        "class": "transition-rule",
        "selectors": [
          ".scipquery/transition-rules/*.json"
        ],
        "authority": "fixed-predecessor"
      },
      {
        "class": "evaluator",
        "selectors": [
          "src/domain/autonomous-completion*.ts",
          "src/runtime/agent-hooks.ts",
          "src/runtime/completion-evaluation-context.ts",
          "src/runtime/diff-gate-execution.ts",
          "src/storage/autonomous-completion*.ts"
        ],
        "authority": "bootstrap-trust-root"
      },
      {
        "class": "test",
        "selectors": [
          "**/*.spec.*",
          "**/*.test.*",
          "**/__tests__/**"
        ],
        "authority": "fixed-predecessor"
      },
      {
        "class": "baseline",
        "selectors": [
          ".scipquery-baseline.json"
        ],
        "authority": "fixed-predecessor"
      },
      {
        "class": "suppression",
        "selectors": [
          ".scipquery/suppressions/*.json"
        ],
        "authority": "fixed-predecessor"
      },
      {
        "class": "configuration",
        "selectors": [
          ".scipquery.json"
        ],
        "authority": "fixed-predecessor"
      }
    ]
  },
  "targetObservation": {
    "schemaVersion": 2,
    "observedAt": "2026-07-31T06:42:04.354Z",
    "facts": {
      "collaborationDomain": {
        "schemaVersion": 1,
        "canonicalizationVersion": 1,
        "hashAlgorithm": "sha256",
        "projection": {
          "name": "scip-query:collaboration-domain",
          "version": 1
        },
        "digest": "65fa7070a947c694f38de6708f2444d2bc2642785dcdb898d24a0401b41fb3c3"
      },
      "workspaceInstance": {
        "schemaVersion": 1,
        "canonicalizationVersion": 1,
        "hashAlgorithm": "sha256",
        "projection": {
          "name": "scip-query:workspace-instance",
          "version": 1
        },
        "digest": "f53b738aebdbca65df7f5d79a4bfc01cb854528c2a00705171682a625937c0c4"
      },
      "wholeContent": {
        "schemaVersion": 1,
        "canonicalizationVersion": 1,
        "hashAlgorithm": "sha256",
        "projection": {
          "name": "scip-query:repository-content",
          "version": 1
        },
        "digest": "2633968913213cd3f1818330283d98fcbff2688532579ce5eaddabc6619cc860"
      },
      "relevantInputs": [
        {
          "subject": "scip-query:index-inputs",
          "identity": {
            "schemaVersion": 1,
            "canonicalizationVersion": 1,
            "hashAlgorithm": "sha256",
            "projection": {
              "name": "scip-query:index-inputs",
              "version": 2
            },
            "digest": "8e4c09977cf9f13fd31d58d068d25b752f5241baf5e03c1f5d6103756a31e3c4"
          }
        }
      ]
    },
    "observedSources": [
      {
        "kind": "repository-snapshot",
        "identity": {
          "schemaVersion": 1,
          "canonicalizationVersion": 1,
          "hashAlgorithm": "sha256",
          "projection": {
            "name": "scip-query:repository-content",
            "version": 1
          },
          "digest": "2633968913213cd3f1818330283d98fcbff2688532579ce5eaddabc6619cc860"
        }
      }
    ],
    "stabilityProofs": [
      {
        "source": "repository-snapshot",
        "kind": "fixed-snapshot"
      }
    ],
    "diagnostics": {
      "clean": false,
      "headCommit": "cd68864c0326b955f300cfb6ddafe3e3c83b9384",
      "treeOid": "4b278b1c74f2831aedc99143c060cc531871640e"
    }
  },
  "capturedAt": "2026-07-31T06:42:04.354Z",
  "createdAt": "2026-07-31T06:42:04.354Z",
  "writer": {
    "tool": "scip-query",
    "version": "0.20.0"
  }
}
